{
  "$schema": "https://json-schema.org/draft/2020-12/schema",
  "type": "object",
  "properties": {
    "schema_version": {
      "const": "market.evidence.v1"
    },
    "market": {
      "const": "US"
    },
    "market_date": {
      "type": "string",
      "format": "date"
    },
    "timezone": {
      "const": "America/New_York"
    },
    "scheduled_close": {
      "type": "string",
      "format": "date-time"
    },
    "evidence_cutoff": {
      "type": "string",
      "format": "date-time"
    },
    "collected_at": {
      "type": "string",
      "format": "date-time"
    },
    "sources": {
      "type": "array",
      "items": {
        "type": "object",
        "properties": {
          "id": {
            "type": "string",
            "minLength": 1
          },
          "title": {
            "type": "string",
            "minLength": 1
          },
          "publisher": {
            "type": "string",
            "minLength": 1
          },
          "url": {
            "type": "string",
            "format": "uri",
            "pattern": "^https://"
          },
          "published_at": {
            "anyOf": [
              {
                "type": "string",
                "format": "date-time"
              },
              {
                "type": "null"
              }
            ]
          }
        },
        "required": [
          "id",
          "title",
          "publisher",
          "url",
          "published_at"
        ],
        "additionalProperties": false
      },
      "minItems": 1
    },
    "observations": {
      "type": "array",
      "items": {
        "type": "object",
        "properties": {
          "id": {
            "type": "string",
            "minLength": 1
          },
          "metric": {
            "type": "string",
            "minLength": 1
          },
          "value": {
            "type": [
              "number",
              "null"
            ]
          },
          "unit": {
            "enum": [
              "percentage_points",
              "count",
              "usd",
              "ratio",
              "index_level"
            ]
          },
          "reference_period": {
            "type": "string",
            "minLength": 1
          },
          "classification": {
            "enum": [
              "actual",
              "estimate"
            ]
          },
          "source_id": {
            "type": "string",
            "minLength": 1
          },
          "observed_at": {
            "type": "string",
            "format": "date-time"
          },
          "verification": {
            "enum": [
              "verified",
              "unverified"
            ]
          }
        },
        "required": [
          "id",
          "metric",
          "value",
          "unit",
          "reference_period",
          "classification",
          "source_id",
          "observed_at",
          "verification"
        ],
        "additionalProperties": false
      },
      "minItems": 1
    }
  },
  "required": [
    "schema_version",
    "market",
    "market_date",
    "timezone",
    "scheduled_close",
    "evidence_cutoff",
    "collected_at",
    "sources",
    "observations"
  ],
  "additionalProperties": false
}
